Sentence,Global start,Global end
The quarter?,22929.10739,22929.76652
And this is a pretty high running pastal.,22934.644080000002,22940.11042
One total turn.,22965.714490000002,22966.854170000002
Copy.,22968.11329,22968.61329
And you'll back it out with bravo seven counterclockwise two.,22968.69151,22972.58981
That's affirmative.,22974.20875,22975.02859
Two turns.,22975.288200000003,22975.94813
Okay.,22976.876220000002,22977.35598
Understand.,22977.35598,22977.85598
K.,22977.91569,22978.41569
Two times.,22983.83274,22984.49265
Okay.,23023.74548,23024.14527
Ruben is continuing to troubleshoot that lower strut working with the pistol grip tool and the ratchet wrench to give it another attempt to securing that bolt on the bottom of strat.,23024.14527,23036.31651
"In the meantime, the station is two hundred and sixty one statue miles over Venezuela looking at the Caribbean just off in the distance and about to pass over Brazil.",23036.57614,23047.48011
"Hey, I before you leave, that works that works right there?",23086.62829,23089.686550000002
If you can just make sure that the MOI on the upper struts where that meets the bracket and that is secure.,23089.926420000003,23096.58334
"Hey, thank you, Lars.",23098.340750000003,23099.260280000002
Let's double state the upper structure.,23099.260280000002,23100.73956
I'm a liability place.,23100.73956,23101.79925
"I'm off the mining wacker, the IT structure.",23102.25878,23105.357480000002
Alright.,23113.94149,23114.221370000003
"And, Frank, say again, how many turns?",23114.221370000003,23116.00072
What's this?,23116.06045,23116.68038
Okay.,23118.1394,23118.45922
We're just gonna drive the bolt completely out and do an inspection of the bolt.,23118.45922,23122.066550000003
At the interface.,23122.10652,23122.92639
We anticipate approximately ten turns.,23124.18548,23125.944600000003
You have an extension.,23125.944600000003,23126.884390000003
Pardon?,23129.18302,23129.68302
K.,23152.33952,23152.499440000003
Ruben standing by for the number of turns needed to completely undo the bolt on the lower right strut.,23152.499440000003,23158.126020000003
"In the meantime, Victor Glover is going around the structure, the modification kit and just making sure that all of the multilayer insulation the white fabric that's completely wrapping the modification kit, making sure all parts of that are secured.",23158.126020000003,23173.52777
"And I it looks like from what we saw on the WVS, the MOI on the left are per strut for the triangle where the left upper strut and the bracket meet wasn't quite in place.",23215.911340000002,23229.54318
Are you able to translate back up there?,23229.54318,23231.682340000003
And address that okay.,23232.05136,23235.00988
Alright.,23235.00988,23235.32974
It was it.,23235.32974,23236.14956
"And since it was seven and a half turns, I have it output my two's pretty close.",23237.76852,23242.45605
Taking a look at the interface for an inspection.,23243.11547,23245.21469
I don't see anything on the threads and mister my PGT and get a closer look.,23246.034020000003,23250.09225
Copy.,23253.749020000003,23254.249020000003
And I see the interface.,23280.75342,23282.172970000003
Completely clean.,23282.96127,23284.180900000003
Mass canister.,23285.91979,23286.699640000003
I'll check the bolt out.,23287.359060000003,23288.73862
Okay.,23290.077690000002,23290.577690000002
Complicate on the interface.,23291.186360000003,23292.545680000003
"And as you check the bolt, if you could depress it so that as many of the threads stick out as possible, that's great.",23292.545680000003,23298.402980000003
"Hey, Frank.",23303.02932,23303.54907
I'm also on the wait until you're done with this email.,23303.54907,23306.44787
Being installed?,23306.69642,23307.296120000003
Or do you want to go okay.,23307.296120000003,23309.01525
"Now it looks like both sides go right in, left over the truck.",23309.01525,23311.914060000003
That's the task.,23312.253660000002,23313.393320000003
Since the yellow line here is the mounting bracket is still folded up.,23314.701220000003,23318.079820000003
Yep.,23322.95562,23323.275520000003
"Like, we concur on both sides, and we'll just wait until we're done with this lower strut, so we're not applying unnecessary.",23323.275520000003,23330.492120000003
Starts on the structure.,23330.84152,23332.061220000003
Okay.,23334.63962,23335.13962
"Yeah, sir.",23341.80456,23342.28436
I didn't see that one else on the correct side.,23342.28436,23344.36328
"I adjusted DMOI on the lower strip, the top coat of the lower strip.",23344.36328,23349.419850000002
Yep.,23351.11877,23351.358620000003
No worries.,23351.358620000003,23351.878350000003
That's a tough angle to see.,23351.878350000003,23353.40652
From where you are?,23353.486520000002,23354.20617
In a boat.,23354.20617,23357.264890000002
Okay.,23358.364070000003,23358.864070000003
But please drop it in seconds.,23359.56347,23361.142920000002
Pushing the bolts in.,23362.65087,23364.030450000002
"I see the same, I call it, yellowish orange in the threads.",23364.609920000003,23369.54766
Starting from the pull away from the bolt head at the point at thread number four.,23370.52648,23378.34282
I have eight threads.,23380.71038,23382.01002
National thread itself was fine.,23382.58942,23384.60872
"We'll probably Kate, and that was a great view.",23387.83648,23389.875480000002
Thank you.,23389.875480000002,23390.61535
It's okay.,23395.76522,23396.28497
We'll try to drive again.,23396.28497,23397.744420000003
And if you can try to,23398.84368,23400.00158
Annually align and start turns.,23400.04156,23403.3401601
"Space walk team here in Mission Control Houston, inspecting that boat, getting great views with the high definition camera.",23410.41488,23416.15226
"Mention it look good, so they're gonna go ahead and try to reinstall the lower strut to the base of the mass canister.",23416.55146,23422.80858
Canted a little bit.,23423.5165,23424.85608
"I'd say a millimeter two, and it will not rotate.",23425.59546,23428.13444
Okay.,23432.04106,23432.48084
Understand the circle bearing essentially is misaligned and you're not able to push it into proper alignment.,23432.48084,23437.87814
Sure.,23437.87814,23438.37814
And that would not work.,23441.106522000002,23442.72596
Okay.,23445.26444,23445.76444
We're checking.,23445.904122,23446.38388
K.,23446.38388,23446.88388
A RET would not work.,23449.54156,23450.58104
That's the negative.,23450.58104,23451.48084
Copy.,23453.939362,23454.439362
I'll I'll borrow it pretty shortly.,23455.01882,23456.29818
"Thank I could possibly use the racket wrench on one side, but my not moving, but we'll wait for your go.",23456.29818,23468.76088
Okay.,23477.2064,23477.6062
"We think unfortunately, this is very similar to what we saw on the other side.",23477.6062,23481.464524
So we'll try some of where we did just hand start and drive the bulk and see if that aligns it as we drive it.,23481.6042,23488.20056
And I do have some this two turns.,23494.49716,23496.32613
Right?,23496.32613,23496.526025
You too.,23496.526025,23497.58575
And I've got a proposal for you.,23506.15037,23509.648865
Alright.,23510.228326,23510.548165
Why don't I hand started as far as I can?,23510.548165,23512.76659
Okay.,23514.485726,23514.84554
That works for us.,23514.84554,23515.68513
"Thanks, Jake.",23515.68513,23516.425
Three.,23523.13997,23523.63997
"I After a hard time to answer, Copy.",23535.4331,23544.80613
Five turns.,23544.80613,23545.48578
And your settings will be bravo seven clockwise two.,23545.48578,23548.90434
Please.,23550.94157,23551.18145
Seven.,23551.18145,23551.68145
Dockwise two steps.,23555.6992,23557.35861
And total turns we were expecting on this?,23557.69819,23560.28567
Got five down.,23560.46533,23561.52505
"So, Kate, the total turn should should have been around.",23572.8689,23576.88715
"Fourteen, and so we're looking for another correction in the sixteenth.",23578.13615,23582.33404
So we're looking for another eleven turns.,23582.33404,23583.97323
"But, really, we would just want you to drive it to torque at this point.",23583.97323,23586.75208
Okay.,23587.78111,23588.28111
It worked.,23588.46076,23589.12069
Alright.,23593.29835,23593.61819
"So a few hand tightening techniques, a couple of extra turns with the hand and now using the pistol grip tool.",23593.61819,23600.15412
We'll see how this works for the last attempt for the installing the lower struts.,23600.61364,23606.73986
Twenty three.,23607.47924,23608.11892
That's the low zero.,23608.11892,23609.21862
That's the green light.,23609.59818,23610.91752
That's the low struts part.,23610.91752,23612.24658
Good day.,23614.0057,23614.70559
That's my good torque.,23617.52393,23618.64338
Twenty five decimal four.,23618.64338,23620.31158
That's another five turns plus a half after the load took.,23620.75135,23624.00997
Okay.,23634.55151,23635.05151
We see a cadence.,23635.15121,23635.91084
We see the wiggle as you move it.,23635.91084,23637.85011
Can you do manual ratchet at thirty point five?,23638.30964,23641.12847
Yes.,23658.12868,23658.62868
Come down.,23689.42074,23690.28054
Copy.,23696.04604,23696.40585
I understand torque that.,23696.40585,23697.40536
Didn't look like he got any additional turns.,23697.40536,23699.42458
Yeah.,23701.36338,23701.7232
We did it.,23701.7232,23702.50304
No movement.,23702.56278,23703.1827
Okay.,23711.77642,23712.27642
Copy.,23712.85586,23713.29565
"And at this point, we'll just take what whatever turns you can get with the ratchet wrench.",23713.29565,23717.63372
"And, like, at this point, you have a go to address that MOI at the top of the triangle.",23736.2814,23741.59872
Really?,23741.59872,23742.09872
So the quarter turn?,23769.91235,23771.21194
Three.,23781.81585,23782.31585
And that's it.,23783.05523,23784.014760000002
And it's I don't know if you can see it in HEPA.,23784.014760000002,23786.35384
It is canted.,23786.8933,23787.993
From the side to side.,23789.39101,23790.73058
"And with the flat eight, the full head is fully seated against the receptacle interface at the top.",23791.03018,23797.77658
I think that's how you're gonna get.,23798.21636,23799.99572
Okay.,23801.13488,23801.63488
We copy.,23801.73458,23802.2943
"And we see that, Kate.",23802.2943,23803.41375
If you could just do one additional work on test for us.,23803.41375,23806.5924
Okay.,23829.02786,23829.30773
Ready for the middle part?,23829.30773,23830.68728
Sorry?,23832.77568,23833.27568
"So in my view, the label m nineteen, We call that top to bottom, which is the base of the joint.",23836.33392,23843.5801
I've got no motion.,23843.71978,23844.81948
Alright.,23846.07861,23846.518360000002
How I'm looking at it?,23846.518360000002,23847.4779
Venus neither.,23847.4779,23848.41768
No motion.,23848.59734,23849.33721
"Left to right, I've got just a little bit, and the bolt is hitting closest to the m nineteen.",23850.06631,23855.96362
Okay.,23858.10095,23858.54073
Understand a little bit of left to right motion with the golf hitting closest to m nineteen.,23858.54073,23863.27862
"And in that axis, no no movement.",23865.78646,23868.68528
Copy.,23870.704,23871.18378
Okay.,23871.18378,23871.68378
What distance do you estimate between the black line?,23872.18328,23874.72225
Being flushed at the current location.,23874.89156,23877.19068
We get an iPhone.,23879.92904,23880.90881
A millimeter?,23885.38598,23886.08588
Possibly two millimeters.,23887.26504,23888.56463
Okay.,23889.26403,23889.70382
Copy.,23889.70382,23890.02368
One or two millimeters.,23890.02368,23890.96343
Degree of offense furnace is look at the full head completely completely flush.,23900.03722,23907.48373
Copy.,23910.88146,23911.28124
"Thanks, Kate.",23911.28124,23912.02111
Okay.,23915.87898,23916.19878
We're discussing our onboard screen shortly.,23916.19878,23917.94665
"So Kay Rubins was able to undo the bolt on the lower right strike, which has been giving some difficulty on the installation process here.",23925.68138,23933.17663
"Was able to reinstall using the pistol grip tool and give it an extra tug with the ratchet wrench, giving it a little extra torque.",23933.61638,23940.22161
She's showing minimal movement from some of her wiggle tests.,23940.86132,23944.35978
Now the engineers here in Mission Control Houston are assessing some of the next steps.,23944.77938,23949.60662
"Making sure that that is good to go before they head into potential wrap up procedures to end today's space lock, which is waiting for word for mission control on some of these next steps.",23949.64658,23961.87988
A little trickier when I'm running the VOT.,23966.15668,23968.27563
Okay.,23968.27563,23968.77563
While Rubens waits for some guidance from Mission Control on the status of the lower strut.,24052.60084,24059.577599999997
"Glove is continuing to secure that multilayer insulation, the white fabric that completely surrounds the modification kit.",24061.266502,24069.261639999997
Making sure all parts of the multilayer insulation are completely secure.,24069.701419999998,24074.719159999997
"Alright, Kate.",24145.365729999998,24146.44518
So first thing we're gonna have you do is go ahead and do a socket drop from the ratchet wrench to the PGT.,24146.44518,24152.46242
And then we'll throw the Roger wrench in the two bravo bag.,24153.091419999997,24156.8298
Great.,24158.808559999998,24159.04844
Copy.,24159.04844,24159.54844
Go back to the PGC and the IEA.,24162.61639,24164.515679999997
Okay.,24185.62154,24185.90141
Copy.,24185.90141,24186.40141
Sure.,24186.94088,24187.44088
Hi.,24255.29917,24255.79917
It's pulled up from the socket two inches back on the CTMA.,24291.47872,24294.177639999998
Copy.,24296.955589999998,24297.455589999998
Okay.,24306.19094,24306.550769999998
"You can store that, Roger, in the two bravo bag.",24306.550769999998,24308.829609999997
Alright.,24308.829609999997,24309.329609999997
And Taking a look.,24313.307399999998,24317.49502
"Mike is and our cutters, maybe.",24319.833609999998,24325.19994
Each other is underneath him.,24330.38659,24332.00604
So I propose I leave it on structure.,24332.265639999998,24337.003539999998
"And if he's getting the two bravo bags, he pick it up.",24337.88137,24340.480059999998
I don't like that to cross others.,24340.480059999998,24341.97958
We're bringing the PGT back in the bag as well.,24352.014,24354.511619999997
Okay.,24370.901479999997,24371.18134
We're gonna we agree with your plan for the Roger wrench.,24371.18134,24374.39996
"We're discussing the plan forward, which is gonna affect what we're gonna do with the PGT.",24374.69958,24378.497669999997
So I'll have words for you shortly on that.,24378.497669999997,24380.566609999998
Okay.,24381.9659,24382.32574
I'll still do the accurate and straight next to the PGT.,24382.32574,24384.50491
It's got an adjustable on it.,24384.92444,24386.58384
Alright.,24416.264669999997,24416.58454
I'll grab this.,24416.58454,24417.644239999998
K Rubins and Victor Glover.,24417.783939999998,24419.871639999998
"Wrapping up some of their work on the two b work side, this is the two bravo power channel on the earth facing side of the International Space Station's port six Truss the very far end of the port side.",24420.3514,24432.025569999998
"Right now, Mission Control is discussing some of those next steps given a timeline ahead.",24434.92388,24439.95119
The configuration of the modification kit meets the minimum requirements needed to just Keep it there in place.,24442.40972,24448.66594
It is tied down.,24448.66594,24449.62548
They may readdress it on a future space walk.,24449.62548,24453.40384
To give the bolts a couple extra turns and make sure that it is secure and ready to hold those solar arrays expected later this year.,24454.57156,24463.427389999997
"While they deconfigure their worksite, redo their tethers and and put away some of their tools.",24466.31554,24475.020099999998
They're just standing by for some words on what to expect next.,24475.239739999997,24478.41839
Take grab the PGT two.,24492.119189999998,24493.35857
Are we still waiting on that?,24493.35857,24494.39806
We're still waiting on that.,24494.39806,24495.546619999997
"This is the helmet camera view from NASA ashenaut, Kate Rubin.",24568.56424,24572.76094
She's standing by for words from mission control on some of the next steps.,24572.76094,24576.81914
She's hanging onto one of the handrails at the integrated electronics assembly that holds the batteries that store power drawn from the to be power channel.,24578.8164,24588.191939999997
The solar arrays there and store power and new lithium ion batteries.,24588.581469999997,24592.00004
So the first thing is great job on working through the too broad outside.,24592.33959,24597.126239999998
I know there are some challenges there.,24597.126239999998,24598.5255
So thanks for sticking with us.,24598.5255,24600.00164
"But the thing is that structure is in a safe config for ISS, and it can currently will not affect BDA movement or loads.",24600.6813,24610.42504
And so we're in a safe config there.,24610.42504,24611.9043
We're in a safe config there.,24611.9043,24614.04348
"Excellent news, Frank.",24615.142680999998,24616.22164
The plan forward as we see it is we're gonna reposition the APFR over to the full bravo side with thirty seven and that way it's available for the next EVA.,24617.98076,24628.17556
Our goal will be to clean up the two bravo side and then go up to the four bravo side.,24628.675059999998,24633.692799999997
Build the upper triangle and then see where we are from there.,24634.181399999998,24638.19964
"Most likely, we're gonna look at tie down options for that.",24643.056343,24645.915159999997
"And we do have a hand over here in twenty seconds, so I'll have more for you guys on the other side.",24647.654039999998,24652.441641999998
"A good summary from As we lose video from a handover of some of that some of the feeds from the International Space Station, we had a good summary from ground IV Frank Rubio.",24663.724582,24683.860664
"Essentially, the modification kit that Rubens and Glover both installed on the two b power channel isn't a good configuration for now.",24685.199744999998,24694.813439999998
They may add readdress some of those struts and during a later spacewalk.,24694.813439999998,24699.840835
"But for now, it's in a safe configuration to take the loads that go with space station attitude control and and the flight there.",24699.980519999997,24708.53518
"And Kate Pike, back with you, how do you read?",24708.874755999997,24711.133879999998
Is left.,24714.781616,24715.5215
Okay.,24720.4188,24720.658676
I understand.,24720.658676,24721.17842
"And, Kate, you had a question right before the handover?",24721.17842,24723.43754
We could Yeah.,24723.857079999998,24726.95536
Would you like me to start getting the WIFX and APFR and my BRT?,24726.95536,24730.5738
"Yes, Kate.",24738.859399999998,24739.29917
That would be great.,24739.29917,24740.17874
"And that'll be your primary task will be to reposition that Hey, dear, for our Webex.",24740.17874,24745.23624
"Time before only building the upper triangle on the other side, we need what do you wanna do?",24751.241609999997,24756.119179999998
PGT wise in in the bag.,24756.119179999998,24758.13842
"I mean, that's the long one on my foot now on the third one's on the IEA.",24762.54595,24766.244359999997
Okay.,24769.51099,24769.83084
I need both.,24769.83084,24770.65067
"Oh, that happened.",24803.22974,24804.209509999997
"And I copy, Mike.",24805.02884,24806.28846
"And, hey, we're we're checking on that.",24810.435859999998,24812.834659999997
Nice to be rung company.,24812.834659999997,24814.2542
Okay.,24822.05954,24822.37939
That's it.,24822.37939,24823.11927
Webex and APFR that is on my DOT driver.,24823.25895,24826.997339999998
Okay.,24827.45686,24827.80662
"Like, we we agree with your plan.",24829.28588,24831.105219999998
We should only need the short PGT to build the upper triangle.,24831.124959999997,24834.063739999998
"And so if you wanna swap out, you can leave the wrong PGT on the two alongside and take the short PGT with you.",24834.32336,24841.16015
Am I leaving the bag or am I talking with the bag now?,24850.27509,24852.89404
We're gonna we're gonna lose the bag for now.,24854.83158,24857.19039
Like Okay.,24857.19039,24861.96824
Okay.,24864.066939999997,24864.566939999997
"Got the rifts, and I met it back inboard, the triangle, and then Copy.",24864.81658,24876.08971
"And, Kaye, right now, on video, we're seeing at your ingress age.",24876.869069999997,24880.72741
Is still extended.,24881.146539999998,24882.046339999997
I do you wanna do a visual on that?,24882.34594,24883.74524
Just make sure that you don't need to address that before she starts to translate.,24883.74524,24886.684009999997
All I see is this done right now.,24890.101039999998,24892.00034
And you see where you can see that case on?,24896.45784,24898.216969999998
Yep.,24898.216969999998,24898.71661
"So again, the modification kit on the two b power channel, you can see a really good view from this angle as the sun sets in an or into an orbital night time.",24914.82647,24923.75161
Station is on the So let me consume a room.,24924.1914,24927.62966
Alright.,24927.62966,24927.829579999998
We're about two hours down on the time line to build the upper try and go and get it properly stowed.,24927.829579999998,24934.7362
We are looking at going slightly over seven hours.,24934.795919999997,24938.09454
I just wanna see how how you guys are feeling and what's your thoughts are on that plan.,24938.514059999998,24942.941609999998
Yeah.,24950.856239999997,24951.17611
Just be careful.,24951.17611,24951.935719999998
We got no time to do a good ingress.,24951.935719999998,24953.6751
That that does account for plenty of time for Ingressgate too.,24957.271569999997,24960.61016
So it sounds like the crew is up four going on the other side on the four bravo side that faces space.,24981.81644,24988.013339999998
The observation path is gonna look very similar from when you went and got the Roger Ranch.,24988.013339999998,24993.070239999997
"As the sun sets into an orbital night time, they're continuing to wrap up their work side on the two bravo side.",25000.64494,25005.94256
"Rubin's about to take the portable foot restraint over to the other side and glover working with some of the pistol grip tools, making sure he has the right one to take over to the four bravo side.",25006.73141,25020.39404
"Their next task is to build the upper trying angle, which was the first task of today for the two bravo side.",25020.813589999998,25025.99024
We'll start that on the other side and simply just tie it down.,25026.0899,25030.028189999997
Leave it in a good configuration nice and tight for them to address it on a on the next Space Walk scheduled for March fifth.,25030.84624,25039.940789999997
Rubens will head out in the hatch with Suucci next Friday.,25040.200399999998,25044.73836
Copy.,25047.36636,25047.86636
And then you can begin your translation to the four bravo side.,25047.8861,25051.004539999998
Yours is much family of translation.,25051.004539999998,25052.98379
You should just be able to go Zenith on the outboard forward aspect of the IEA.,25053.04351,25059.199539999998
Alright.,25190.710339999998,25191.03014
I'm at the triangle.,25191.03014,25192.049939999997
Copy.,25194.02868,25194.52868
A little bag.,25195.21794,25196.16784
"And I once you are at the bag, you can go ahead and secure the bag open.",25200.72122,25205.09928
"Guys, for your situational awareness, we are moving the arm for improved camera views.",25216.63118,25222.40854
You think I went up the triangle.,25293.70464,25295.52398
"He missed, I believe, and they'll get it back in.",25296.343316,25299.76186
Recruited occurred faster.,25300.05146,25302.2706
Right.,25305.288834,25305.48874
I got stupid.,25305.48874,25306.42852
Yep.,25307.74612,25307.986
It's okay.,25307.986,25308.46576
I understand you are on the Zenith aspect of the training structure.,25308.46576,25311.824075
Correct?,25311.824075,25312.324075
Okay.,25318.78045,25319.22023
So you will head outboard.,25319.22023,25320.559815
"And when you get to the near aspect of the IEA, your head aft.",25321.459115,25327.48499
Alright.,25345.43522,25345.93522
But I'm gonna put it down a little while.,25352.65125,25354.99033
"During an orbital night time, Rubens and glover, both heading over to the other side of the port six truss now on the space facing side.",25392.64898,25401.89346
"They'll start some of the work on the four b channel, getting some of their tools in place and ready to access very quickly.",25402.33151,25411.42719
On the next spacewalk.,25411.92645,25413.345980000002
Okay.,25414.92495,25415.36472
Do you have a handrail number for us in your current location?,25415.36472,25420.3025
Yes.,25425.01954,25425.51954
Is this the ATFR?,25425.85912,25428.11825
This fax is the thing.,25428.88635,25429.92582
It's just like six minutes.,25429.92582,25432.02502
Five three eight five.,25432.20468,25433.8641
I copy that I'm headed out.,25434.88334,25436.17158
For it.,25436.21156,25436.91146
Copy.,25437.09112,25437.41096
Five three eight five.,25437.41096,25438.17057
Thank you.,25438.17057,25438.95043
Flight controllers checking Ruben's location.,25449.044280000002,25451.10349
One of her tasks is to stow the portable foot restraint that she's been using throughout the duration of today's spacewalk.,25451.16322,25457.02978
"Get it nice and close to her worksite, and she'll have to address next spacewalk.",25457.56928,25462.02728
