Sentence,Global start,Global end
K.,8948.56234,8948.76224
You doing okay before we start the BRAC assembly?,8948.76224,8952.44008
I am go get my bag.,8954.45884,8956.13804
Okay.,8956.13804,8956.63804
"And the backside, tape towards left insert, and rail is fully pointing a little bit more nadir across the office.",8960.43524,8970.97939
And I'm ready to join f pike.,8971.4789,8973.53814
Okay.,8975.596880000001,8976.096880000001
"Complicate, so we will go pick up the APFR and WIFX.",8977.385040000001,8980.28374
You're gonna head nadir on the same front instructor that you came up on.,8980.42348,8985.36129
And just take care not to loop your safety tether around the trunnion.,8985.59029,8988.50881
K.,8988.50881,8989.00881
Copy.,8991.18754,8991.68754
Hi.,8995.22487,8995.72487
Are you ready for assembly?,8995.94448,8997.36404
Okay.,9004.078300000001,9004.4781003
Your first one or retrieve the mounting bracket?,9004.4781003,9006.9371205
"And we'll be attaching the right upper strap, which should be straps one and two.",9007.995,9013.092700500001
Case and feedback for you.,9015.28,9016.439421000001
"While I'm thinking about it, our plan to minimize red swaps, wants to take the mounting bracket away from me.",9016.439421000001,9022.96534
"So since the red is stretched out and it's, you know, pulling to the left, it wants to take the mounting bracket to the top order to the IEA.",9023.00532,9030.661740000001
"Not not a huge deal, but I think I'd almost rather do the red swap.",9031.840100000001,9035.638200000001
So I can have it first stable while I'm doing the work.,9035.638200000001,9038.457040000001
I'm gonna lock that red out for now.,9038.516762000001,9040.036
It shouldn't be a problem.,9040.036,9040.92534
Okay.,9043.32414,9043.72394
We copy it.,9043.72394,9044.36362
And it sounds like a good plan to lock it out.,9044.36362,9046.78266
Lock it out.,9049.8009,9050.610340000001
Alright.,9051.21004,9051.52988
Thanks.,9051.52988,9052.02988
Got the mounting bracket.,9052.409440000001,9053.629082000001
Okay.,9055.0881,9055.447922000001
"Next, you'll retrieve the right upper strap, straps one and two.",9055.447922000001,9059.03534
Stop on dockings dockings.,9061.753980000001,9064.53284
"I mean, the rates are pushed through.",9066.3117,9068.29096
What you're seeing now is the helmet camera view from Victor Glover.,9072.39832,9076.456540000001
He's inside the strut bag now.,9076.975260000001,9079.47426
And while Kate Rubins is going to grab a portable foot restraint she gets a good angle on some of the work that both Glover and Reuben's have ahead of them.,9079.57396,9088.768124
Glover's gonna go ahead and get a head start.,9088.78786,9090.746884
He's already starting to construct the park one part.,9090.746884,9094.935000000001
It's called the triangle.,9095.234610000001,9096.31407
It's on the very top portion of the configuration of the modification kit.,9096.31407,9100.89035
So he's gonna get a head start and start putting that together while Kate Rubins goes and retrieves a portable foot restraint.,9100.930325000001,9107.42733
It's upper right to the bracket first truck.,9111.823506,9114.562380000001
"That's affirmative, Mike.",9116.821,9118.130345000001
And I have PGT settings for you when you're ready.,9118.290265,9122.64808
You'll be using your short PGT.,9122.64808,9124.22754
"And, Frank, do you want me to go inboard of the triangle on the way down Yeah.",9137.94841,9155.12894
"Kate, you may wanna go outboard of the trunnion and just follow your tether back.",9155.14869,9160.4063
"And, Kate, inboard or outboard doesn't really matter whatever works easier for you as long as your safety tether does not loop around.",9171.078790000001,9177.76535
The trunnion.,9177.80534,9178.46526
Okay.,9182.403040000001,9182.903040000001
"The translation path for the astronauts is critical, making sure that they're following their safety others along the way and avoiding any and avoiding any specific areas of the station's trust.",9190.568070000001,9202.781770000001
"Again, Rubins is on her way to grab a foot restraint.",9203.050280000001,9205.56902
"What you're seeing now is the helmet camera view of Victor Glover, who's already starting on putting together some of the pieces of the modification kit.",9205.56902,9214.41483
Okay.,9218.87235,9219.27216
"Frank, I started in thirteen to fourteen by I got two turns on the key.",9219.27216,9224.19921
Okay.,9227.89711,9228.39711
We copy.,9228.53679,9229.19672
Good job on that.,9229.256430000001,9229.9361
I So your PGT settings on the short PGT will be bravo three clockwise two.,9229.9361,9235.842760000001
And Cal was passed.,9252.73172,9254.071310000001
"It's just and bravo three, clockwise two, that's it.",9254.250970000001,9259.54844
Affirmative.,9260.08789,9260.58789
Those are good settings.,9260.687600000001,9261.60714
"Bravo three, clockwise two.",9261.60714,9263.2266
And you'll be looking for two additional turns for a total of four turns initially.,9263.32529,9267.083410000001
Four turns total to additional touch dish.,9267.083410000001,9275.15867
"And, Kay, you'll be looking for seated part with three.",9284.4632,9287.40198
Copy.,9289.38074,9289.84034
Okay.,9298.85484,9299.21464
There are four total turns to additional on thirteen.,9299.21464,9301.713660000001
Returns total on fourteen as well.,9306.46004,9308.55924
Okay.,9311.37757,9311.85734
We copy that.,9311.85734,9312.6969
"I next, it will be adding the left upper strut to the center pad.",9312.6969,9318.88314
So you'll retrieve the left upper strut from straps three and four.,9318.88314,9322.62154
Luvs are making good progress on constructing the first parts of the modification kit.,9331.23459,9336.572180000001
He's constructing a triangle that will make up the top portion of the bracket.,9336.75184,9341.229800000001
All the components and struts in the bag were our special actually tied down the bag itself specially designed to carry all of the different struts.,9342.888710000001,9350.84351
"Rubio Frank Rubio here on the ground, the ground IV.",9352.02268,9355.58091
"He's the voice you're hearing from here in mission control, just noting all of the different locations where he can find the various drugs to assemble the correct components, preparing for when Reuben's returns with the portable foot restraint to begin some of the first steps of installing the bracket to the masked canister.",9355.58091,9375.5084
Alright.,9397.91444,9398.27427
Thank you.,9398.27427,9398.714020000001
That's a key to crunch.,9398.714020000001,9399.673560000001
"Thanks, sweetie.",9399.673560000001,9400.313240000001
You too.,9400.313240000001,9400.89319
Complicate.,9404.670320000001,9405.170320000001
We see you at the cedar cart.,9405.34998,9407.08936
Okay.,9407.149080000001,9407.38898
"Real quick, we lost your hecka.",9407.38898,9409.18808
"If you're able to cycle the button for us, that would be great.",9409.18808,9413.40622
Okay.,9415.89434,9416.39434
Okay.,9418.772920000001,9419.09278
I pushed it one.,9419.09278,9420.112490000001
Okay.,9423.37061,9423.80039
"Thank you, Kate.",9423.9603,9424.82014
And are you ready for your APFR settings?,9426.27914,9428.698190000001
I'll set it when I'm out there.,9431.19669,9432.3754
Okay.,9433.25494,9433.75494
Copy.,9433.854640000001,9434.354640000001
Unless you guys recommend for translation now.,9441.35038,9443.64948
Okay.,9449.185370000001,9449.5452
It's it's your preference whether you wanna set it here or set it out at the I am.,9449.5452,9454.163120000001
Do you think I've got two turns on that Seventeen.,9462.837070000001,9466.42504
Okay.,9470.722660000001,9471.16244
Copy.,9471.16244,9471.562240000001
"I I again, you'll be using your short PGT.",9471.562240000001,9474.10024
Your settings now are bravo one clockwise two.,9474.31989,9477.49854
For over one of the phone company.,9482.48434,9484.263710000001
And you'll be driving Mike seventeen to torque.,9488.0004,9490.69931
"We're expecting about fifteen turns, so it should be thirteen additional turns.",9490.83899,9494.81724
I'll be adapting additional turns to torque.,9496.734620000001,9499.0737
"I'm gonna have to try and raise the tool against the structure so that way I can react to my DGT, but the bracket will still move.",9506.02848,9513.10384
So I'm gonna use the tool to stabilize my DGT.,9513.10384,9516.02237
"In that way, hopefully, nothing moves.",9516.02237,9517.58048
Okay.,9520.339090000001,9520.738940000001
"We copy, and we're good with that plan.",9520.738940000001,9522.85784
Right?,9522.85784,9523.35784
Glove are making good progress on constructing what's called the upper triangle.,9527.37449,9531.21254
"This is the top portion that makes up the bracket, the modification kit that will hold a future set of solar arrays.",9531.21254,9537.63858
"He got the Bolt's hands started and is now just finishing up the job with his pistol grip tool, the space power drill.",9537.93821,9544.954810000001
Seven point nine.,9545.054540000001,9546.23414
Got a black line that's flushed.,9549.33237,9550.69169
"If you can see my WBS, I can see the both the head with the black line flush and the tip of the bolt out the backside in the center period.",9550.69169,9558.50804
Okay.,9561.18497,9561.58474
"We copy, Ike.",9561.58474,9562.50431
We're checking.,9562.50431,9562.984040000001
Can you see it?,9562.984040000001,9565.962800000001
We can't see it.,9567.10204,9567.82164
Yep.,9567.82164,9567.9805
We're just checking and making sure that the turns were okay.,9568.060440000001,9570.75937
Copy.,9572.53824,9573.03824
So I understand you had a total of seven turns?,9573.13794,9575.43704
Correct.,9577.76534,9578.26534
"And also, for a data point, it looks like the bolt on the other side.",9592.99747,9596.165500000001
Okay.,9598.72424,9599.163980000001
We copy.,9599.163980000001,9599.68374
I,9599.68374,9600.000540000001
Okay.,9623.356940000001,9623.75674
"Sykes, we're gonna continue checking on this bolt, but we're gonna go ahead and move on.",9623.75674,9627.9539
So you can release the RET from the right strut.,9627.9539,9630.173040000001
I'll do that after I'm done with the bolt.,9632.790260000002,9634.54938
See if you're okay with it.,9634.54938,9635.88896
Okay.,9637.907698,9638.267520000001
That sounds good.,9638.267520000001,9639.245540000002
So we will next assemble the left hand restructure the mounting bracket.,9639.445440000001,9643.023897000001
Okay.,9644.882720000001,9645.3225
Then both are two turns by hand.,9645.3225,9647.341738000001
Okay.,9649.43044,9649.790260000002
Great.,9649.790260000002,9650.190058
Good job.,9650.190058,9650.88996
So you'll wanna drive Mike fifteen for a total of four turns.,9651.02964,9655.0079
This will be two additional turns and your set things are bravo three clockwise two on your short PGT.,9655.747280000001,9660.764000000001
Can you see bravo three clockwise two?,9660.764000000001,9665.78174
Additional turns?,9666.681040000001,9667.64054
On was it just one open?,9667.720500000001,9669.57982
Yep.,9670.9189,9671.4189
So you'll drive Mike fifteen for four turns.,9671.43864,9673.797460000002
Okay.,9673.797460000002,9674.297460000002
K.,9682.08322,9682.363080000001
For Mike McAfee.,9682.363080000001,9683.90256
Okay.,9685.51042,9685.83026
We copy.,9685.83026,9686.31002
And now you will drive Mike sixteen to torque.,9686.31002,9689.068640000001
We anticipate twenty four turns.,9689.068640000001,9690.867735000002
So twenty two additional turns.,9690.867735000002,9693.246794
Be pointing to additional turns sixteen to torque.,9695.26552,9697.844480000002
"Again, glover continuing to assemble that upper triangle.",9707.968620000001,9711.946875000001
The bracket that will consist the top portion of the modification kit for future solar arrays.,9712.51532,9717.11302
"In the meantime, we're getting those high definition views from the helmet camera of Kate rubins looks like she got the portable foot restraint out of its stowed position.",9717.11302,9726.79824
She's going to tether it to herself and carry it over to the worksite.,9727.41768,9731.9943
The first position for the portable foot restraint will be the center of the mass canister.,9732.93358,9737.351610000002
"Allowing her to install that upper triangle, that glover is currently assembling.",9737.72046,9742.3384
You've already got fourteen point five additional turns.,9760.28779,9763.10555
"In light eighteen point two on the torque, and a black line is flushed.",9763.465370000002,9768.922890000002
Okay.,9770.581810000001,9770.901650000002
"I we copy fourteen and a half additional turns, eighteen point two green light and black line flush.",9770.901650000002,9777.36828
"Frank, I'm gonna have to okay.",9779.645390000001,9781.124650000002
So I forgot to put the tab underneath the the part that goes from the left upper structure of the mounting bracket.,9781.124650000002,9786.68188
I just put the tab underneath Okay.,9786.68188,9796.0053
I yeah.,9796.0053,9796.804890000001
So we'll have to back those two bolts out to do that.,9796.804890000001,9800.5033
I'll have settings for you here shortly.,9800.64298,9802.422340000001
Okay.,9804.229730000001,9804.549570000001
Standby.,9804.549570000001,9805.049570000001
It's alright.,9809.627040000001,9810.06681
The settings for that will be bravo three counterclockwise two.,9810.06681,9813.655050000001
Copy.,9816.19354,9816.55335
Bravo three.,9816.55335,9817.273000000001
Counterclockwise two.,9817.273000000001,9822.390420000002
Okay.,9822.390420000002,9822.890420000002
"And, Kate, it looks like the APFR is on the WIFX.",9843.788090000002,9846.72687
And have you started your translation yet?,9846.94547,9848.98444
Okay.,9848.98444,9849.48444
Okay.,9852.4627,9852.942470000002
Great job on that.,9852.942470000002,9853.89054
Great.,9895.84749,9896.087360000001
Thanks.,9896.087360000001,9896.367240000001
Yes.,9896.367240000001,9896.727040000002
This PSR is online.,9896.727040000002,9898.226540000001
I've never looked at from my BRT and headed back towards.,9898.83529,9902.653620000001
Copy.,9905.51194,9905.871760000002
K.,9905.871760000002,9906.371760000002
And you'll be heading back towards the two bravo I a.,9907.58004,9910.838670000001
Copy.,9913.01732,9913.51732
K.,9914.33666,9914.576560000001
"Frank, fifteen and sixteen are correct.",9914.576560000001,9916.31551
How the brackets tab is in both both paths and turns by hand on them.,9916.355490000002,9921.373220000001
Copy.,9925.030040000001,9925.26994
Hi.,9925.26994,9925.76994
"And so I what we're gonna do is just redo these as before, and then we're gonna go back to Mike seventeen and try that one again.",9932.95534,9939.39211
"So first, Mike fifteen, You want a total of four turns, so two additional turns with bravo three clockwise two.",9939.39211,9947.18777
"Raul, thirty fog lights, you can work.",9952.053820000001,9954.3929
A good view of Kate Rubens as she makes her way back to the worksite.,9955.83047,9959.968640000001
She's gonna tag up with Victor Glover who's currently assembling the upper triangle.,9960.02837,9965.325980000001
Portion of the bracket that consists of the modification kit.,9965.735490000001,9968.734
What you're seeing is Kate Rubens with the portable foot restraint in toe.,9968.734,9972.412160000002
"She got that removed from its a stowed position, has it connected to her by way of tether, and she'll be making her way over to the worksite.",9972.412160000002,9980.72714
Her next steps will be setting up that foot restraint for the next series of steps.,9980.72714,9985.46404
Glover already ahead on his tasks and constructing the upper triangle by himself.,9985.80361,9990.18166
He'll be handing that upper triangle over two k rubins once she's secured and in position with inside of the portable foot restraint.,9990.67034,9999.28628
Okay.,10006.362200000001,10006.64204
"Can you verify your gauntlets are in place, please?",10006.64204,10008.54052
Confirm.,10010.49954,10010.99954
"Aaron, please.",10011.419090000001,10012.23891
Thank you.,10012.5385,10013.31838
It's rank on sixteen.,10034.854120000002,10036.713440000001
I hit the button again on accident.,10040.220340000002,10041.919740000001
Sorry.,10041.979440000001,10042.479440000001
I had twenty one additional turns.,10043.69857,10045.957690000001
You like me to hold the PGT on it and and torque it out again?,10048.55507,10051.833460000002
I hit the button after reaching one torque on it.,10051.833460000002,10054.65056
Hi.,10058.928440000002,10059.428440000002
Affirmative.,10059.52814,10060.02814
"If you could talk it one more time, please.",10060.04787,10061.947160000002
Eighteen point five actual torque.,10069.72262,10071.781840000001
"Property eighteen point five, green light, twenty one additional turns, and confirm black line is flushed.",10072.860540000001,10079.2376
Black line flushed.,10080.89651,10081.836290000001
Okay.,10083.27504,10083.674840000001
That makes that a good pull.,10083.674840000001,10085.23406
"And now we'll go back to mic fifteen, and we will same settings, approximately twenty additional turns for a total of twenty four.",10085.23406,10094.76891
You can work.,10097.347370000001,10098.185570000001
I you're looking good.,10102.823240000002,10104.262540000002
Okay.,10104.262540000002,10104.762540000002
A good view of Kate Rubens there on the right of your screen and Victor Glover on the left.,10107.71932,10113.49669
About five minutes away from the day pass.,10113.69554,10115.834710000001
"And, also, hello us in about five minutes.",10115.974440000002,10118.85294
I'll let you know when do we get short closer to that.,10118.85294,10121.23204
"So with the day pass, we'll start seeing the views from the outside of the International Space Station get a little bit brighter.",10125.70944,10131.366870000002
"Glove we're making good progress on the upper bracket, finishing one of the bolts needed to secure the upper triangle.",10133.60474,10139.681690000001
He's working on the next bolt.,10139.681690000001,10141.22118
Corner there.,10142.03051,10142.790140000001
Now you're getting views from the high definition camera of Kate Rubin's helmet camera assembly.,10142.790140000001,10147.807840000001
"As she makes her way to the worksite, she's gonna be installing that portable foot restraint that she has in tow.",10148.26739,10153.40494
And it was nineteen additional turns.,10153.42467,10155.324040000001
Alright.,10157.902440000002,10158.222280000002
Copy.,10158.222280000002,10158.622140000001
"Eighteen point six, nineteen additional turns.",10158.622140000001,10160.82097
"Green light, Confirm black line flush.",10160.82097,10162.88018
Black line flush.,10164.778980000001,10165.71874
Alright.,10178.040540000002,10178.360340000001
I we think that's a good bolt on mic fifteen.,10178.360340000001,10181.459040000002
We'll go back to mic seventeen and try that one again.,10181.79864,10184.597240000001
Your settings for that will be bravo one clockwise two.,10184.597240000001,10187.44561
That'd be bravo one.,10190.16424,10191.28368
That's,10191.28368,10191.78368
Alright.,10203.03908,10203.398900200002
Great.,10203.398900200002,10203.6787602
Let's see.,10203.6787602,10204.118540000001
With thirty eight.,10204.118540000001,10205.17826
"Roger Gate, and you'll install the WIFX on thirty eight.",10208.1553,10211.353700000001
I'll have those settings when you're ready.,10211.353700000001,10213.053100000001
Kate Rubin's has arrived at the worksite.,10233.350220000002,10235.529380000002
Her next task will be to install that portable foot restraint on the designated worksite interface giving her the proper angle to make some of the next procedures of installing that upper triangle that you see Victor Glover is currently assembling the helmet camera view.,10235.549120000001,10251.290140000001
You're saying number twenty is the helmet camera view from Victor Glover.,10251.290140000001,10255.028520000002
And the black line is flushed and it's the metric that looks the same.,10265.292980000002,10269.08984
"There's three threads through the bottom into the, you know, answer pan plug this portion showing up the other side.",10269.2695,10276.905600000002
Identical to the the upper right strip.,10277.305400000001,10280.723935000002
Copy.,10283.94208,10284.44208
"And, Frank, I'll take call in for the WISC number.",10287.020520000002,10289.479540000002
Okay.,10291.978040000002,10292.478040000002
K.,10292.497780000002,10292.697680000001
Your clocking will be six.,10292.697680000001,10294.397084000002
"And, like, that is a good bolt on mic seventeen.",10299.564244000001,10302.263140000001
"So next, we'll be driving mic thirteen and fourteen That's the right upper struts and mounting bracket.",10303.322360000002,10308.959620000001
K.,10313.457120000001,10313.617040000001
Copy.,10313.617040000001,10314.117040000001
And which risk can I take off?,10318.534380000001,10320.473660000001
You can release the RET from the left front and also from the right front.,10321.612840000002,10325.67106
Didn't work.,10327.689600000002,10328.469470000002
I think I'll take your picture and extension on my left hand.,10330.368260000001,10334.146630000001
"Hi, Kate.",10335.325350000001,10336.06522
Webex settings will be six golf five.,10336.124940000002,10339.18367
"So picture five extension of oh, correction.",10339.443290000001,10342.102210000001
Mhmm.,10342.12195,10342.521750000002
Picture of golf Extension five.,10342.521750000002,10344.840250000001
Yeah.,10345.499670000001,10345.999670000001
Six.,10347.17884,10347.67884
Golf extension five.,10348.13836,10349.557900000002
"And, like, your settings for your Right up or stretch the mounting bracket will be bravo three, clockwise two.",10363.57847,10370.87368
Double three clockwise two instead.,10375.930520000002,10377.749850000002
And what's the expected turn?,10379.408770000002,10381.467990000001
And the expected will be twenty on both.,10383.365450000001,10385.72428
We'll be driving both to torque.,10385.72428,10387.70353
"And freight, I may have picks it up.",10390.84171,10392.62023
I do not have a good pull and lift.,10392.62023,10394.139470000002
That's it.,10394.139470000002,10394.879350000001
I'm gonna have my BRT RET.,10395.178960000001,10396.918340000002
"Copy, Kate.",10399.416830000002,10400.135610000001
"And, guys, we have about thirty seconds to hand over.",10410.600010000002,10413.17898
"So, Ike, again, you'll be driving Mike fourteen and thirteen to torque.",10413.1987,10416.9256
We anticipate twenty additional turns.,10417.085530000002,10419.144750000001
"Before we lose this video communication from the International Space Station, we're entering into an orbital date time.",10441.790270000001,10447.727560000001
Views from the helmet cameras of both of the astronauts continuing to get brighter before we lose those views temporarily.,10448.895390000001,10455.552310000001
We're expected to regain them very shortly.,10456.69042,10458.70965
"In the meantime, both of the astronauts are making great progress on some of their first steps to construct the modification kit needed to hold a future set of solar arrays and mount them to the current best canisters of the So a little raise on the far side of the International Space Station, the port six trust.",10460.168660000001,10477.888700000001
Victor Glover is finalizing the assembly of what's called the upper triangle that makes up the top portion of the configuration of the bracket.,10479.027880000001,10488.133300000001
And Kate Rubens is installing the portable foot strain.,10488.133300000001,10492.47045
That'll get her in a good position to mount that upper triangle to the top portion of the mass canister.,10492.47045,10497.747800000001
Twenty fourteen.,10497.747800000001,10498.727560000001
And you can continue with Mike thirteenth.,10501.755500000001,10503.8947
"Here in the room, you're getting a live view from the International Space Station flight control room.",10518.995170000002,10523.472950000001
The teams here led by flight director Marcos Flores.,10523.472950000001,10525.892000000002
The voice you're hearing from here in Mission Control is the ground IV.,10527.120350000001,10530.238800000001
"That's Frank Rubio, a NASA astronaut hired in to the twenty seventeen astronaut class.",10530.238800000001,10536.76482
The spacewalk procedures are being relayed to Frank Rubio by spacewalk officer Art Thomason.,10537.504200000001,10543.081650000002
Name for checking?,10543.850580000002,10544.910300000001
"He's working with him his teams in the backroom going over the intricate procedures, under standing them forwards them backwards as they relieve relay them to Frank Rubio and to back over to Kate Rubins and Victor over on the International Space Station.",10545.249870000001,10560.79973
"Now regaining those views and getting some views of the far port side of the International Space Station, you see Rubins on the right and and glover on the left.",10560.79973,10571.49437
You can see the construction of the upper triangle that darker silver portion is the mounting bracket.,10574.152800000002,10581.479360000001
That is what will eventually hold the irosa solar arrays that will be delivered later this year.,10581.818930000001,10587.915600000002
At least the first two sets.,10588.275440000001,10589.734940000002
Also regaining those high definition views from the helmet camera of Kate Rubens.,10592.713220000001,10597.41112
"And, like, on Mike thirteen and fourteen, those trucks were slightly lower than expected.",10600.928880000001,10605.6465
Can you verify that you have a bravo three setting on your PGT.,10605.6465,10610.064230000002
Okay.,10612.003,10612.402820000001
Yep.,10612.402820000001,10612.6427
